"role","file","source","source_commit","note"
"frq","bet.frq","input-repos/ofp-sam-2026-BET-YFT-frq-build/BET/bet.2023.new-structure.global-cpue.wt-as-len-plus-len.frq","f89e066","copied without year chopping"
"ini","bet.ini","steps/04-NewStructure/model/bet.ini","db26c5e","FixM M row applied from the 01-Diag2023 mgc=-5 diagnostic final par"
"tag","bet.tag","steps/04-NewStructure/model/bet.tag","db26c5e","tag reporting map regenerated from ini/tag; five MFCL reporting-rate matrices parsed"
"age_length","bet.age_length","input-repos/ofp-sam-2026-BET-YFT-age-length-build/BET/bet.2023.new-structure.age_length","a26b694","CAAL input; set age_length effective sample size to 0.75 for 112 records"
"doitall","doitall.sh","steps/04-NewStructure/model/doitall.sh","db26c5e","mixing override removed; doitall exits immediately on MFCL command failure"
