"role","file","source","source_commit","note"
"frq","bet.frq","input-repos/ofp-sam-2026-BET-YFT-frq-build/BET/bet.2023.new-structure.global-cpue.wt-as-len-plus-len.frq","db75a05","copied without year chopping"
"ini","bet.ini","steps/04-NewStructure/model/bet.ini","d652c51","FixM M row applied"
"tag","bet.tag","steps/04-NewStructure/model/bet.tag","d652c51","tag reporting map regenerated from ini/tag; five MFCL reporting-rate matrices parsed"
"age_length","bet.age_length","input-repos/ofp-sam-2026-BET-YFT-age-length-build/BET/bet.2023.new-structure.age_length","a26b694","CAAL input"
"doitall","doitall.sh","steps/04-NewStructure/model/doitall.sh","d652c51","04-NewStructure 5-region controls retained; doitall exits immediately on MFCL command failure"
